Query,RetrievedDocuments
1001149,D398561 D1678969 D954322 D2117298 D1304667 D1717049 D3113293 D811206 D2979000 D246195 D3462168 D3442592 D3298755 D2403620 D1559964 D1935484 D2736207 D1648320 D2321938 D2209307 D1830481 D1519469 D2679376 D1223636 D1783399 D3011611 D3357268 D2984334 D837442 D2200646 D2046736 D1393003 D2872230 D1108736 D175093 D3492633 D563763 D2333603 D3296808 D442910 D2927654 D3223519 D1504331 D996969 D3009489 D1897831 D3377971 D1720162 D2999835 D2399013 D1509737 D638647 D2952133 D2442881 D2096043 D3080617 D424114 D2220569 D443449 D1902863 D1845615 D2125231 D810432 D1809502 D3175584 D1187311 D966571 D2754300 D617364 D1585045 D2643524 D2545379 D1213261 D122071 D2468556 D9077 D395739 D2193856 D1051337 D3196658 D1714344 D408812 D1299667 D265708 D853987 D21472 D1481311 D2755770 D2437890 D3527133 D2472236 D2077590 D344995 D1613714 D930628 D732177 D540613 D1999410 D2117450 D1008862 D16993 D2980881 D627593 D2509316 D432433 D1330247 D1122700 D2197073 D1419276 D379831 D2146217 D2627250 D372313 D406956 D1911840 D1306523 D2080459 D491379 D1266379 D941559 D2348094 D20260 D2253156 D1074621 D2525761 D2893560 D2257759 D154108 D3484406 D1827643 D166713 D3506569 D3207256 D2011868 D572777 D1051544 D368473 D2220126 D1488756 D3248755 D1077883 D2218579 D564353 D1496378 D3201044 D1568694 D536378 D2445545 D3458398 D612714 D629674 D673884 D2519457 D274958 D1297929 D298380 D1121253 D2027702 D3369576 D812586 D235277 D1059834 D2974570 D2832293 D442764 D307510 D1146395 D996804 D84701 D1396004 D876483 D3241919 D62037 D355883 D435050 D567694 D512532 D2554503 D146610 D41618 D327182 D2744374 D1294227 D240559 D1372829 D2377761 D2080227 D2161829 D2972162 D2133352 D386037 D170210 D1976910 D3324042 D3065831 D2383925 D561195 D3089863 D1314619 D15513 D1316991 D2273207 D1969603 D1024962 D488101 D3152550 D126942 D1923639 D3314189 D114228 D2692505 D3070021 D913761 D337107 D512867 D1448239 D1028894 D418375 D144895 D532863 D748675 D2999346 D3047567 D330431 D638152 D2074538 D1704511 D322770 D1064185 D1737423 D3367409 D2618605 D2466022 D2355512 D2782903 D686370 D1846446 D2026282 D3225297 D3280491 D2425986 D2132473 D166417 D312898 D998007 D629711 D2072010 D1978320 D2338562 D2899361 D982730 D1315654 D3174399 D167346 D1863915 D2938018 D1051131 D1894600 D1249489 D279470 D3000214 D3488707 D3233895 D3276027 D513912 D1707568 D1036608 D2596035 D853788 D259137 D2704261 D3539476 D983667 D1362171 D448506 D2523601 D2927443 D2210547 D2367362 D2834771 D1871074 D1038184 D3196205 D2771694 D2590534 D2574661 D382696 D2309200 D2384728 D3318986 D2592704 D1055971 D620028 D903278 D531684 D2463887 D2140971 D2115900 D3486930 D2878732 D3139538 D2955179 D521195 D185539 D2295659 D3077925 D1003444 D374626 D976606 D3309452 D3243389 D1853439 D1730533 D2260663 D1784760 D1739082 D2005532 D2341214 D3454252 D1042221 D2889778 D664085 D564273 D92178 D2888496 D1543620 D1709809 D705864 D2307568 D1771658 D1997715 D2330828 D756483 D1206531 D260523 D860134 D2442019 D1455843 D1069666 D1558720 D2806215 D3075569 D2304369 D1541874 D2907167 D1036248 D996204 D768804 D1568493 D2645115 D931621 D1190448 D3278815 D2552048 D318396 D2081262 D1320973 D3552544 D2741516 D497664 D863825 D2022867 D2727198 D3440424 D728021 D1551421 D3071514 D189763 D1855037 D963522 D1576479 D3192013 D2535542 D2435453 D1658734 D1002679 D715484 D2886245 D866220 D426361 D744477 D1655862 D1726516 D442273 D1233108 D1918464 D992927 D1458736 D1542797 D2222627 D1738121 D3402967 D1474883 D2032782 D2591611 D101326 D1123717 D1675096 D1105767 D1632187 D1261305 D3165037 D3433712 D934311 D3000709 D365582 D1088545 D3366377 D2027571 D2225125 D2005111 D2248376 D2639533 D3161039 D3341152 D3232522 D2520434 D2957844 D2158881 D331856 D3294385 D3207660 D1471300 D2141166 D457387 D2136646 D2666861 D1307769 D1865077 D955417 D1365469 D3278147 D1173570 D771079 D2535397 D1448263 D1675704 D1060014 D3330476 D2963151 D423380 D1403319 D1073818 D279834 D235122 D2234835 D4240 D1160798 D3438995 D435837 D615848 D100637 D83314 D3195869 D2459044 D2442966 D3212918 D1067149 D2249918 D1687540 D2962724 D1815195 D1540728 D1193447 D378339 D34872 D2279124 D740154 D1983821 D2005985 D2866481 D3498734 D1171818 D2158112 D38841 D1974071 D3372713 D1887367 D1187780 D1819623 D700178 D1068252 D2182309 D733245 D1929546 D1127292 D3080098 D109882 D978795 D2279273 D585851 D2611209 D2661828 D2406185 D2534774 D568786 D2395825 D1953995 D575080 D2188167 D3487498 D1753642 D2132296 D2804859 D178291 D167424 D221988 D3398158 D388734 D418008 D3523627 D1848859 D736293 D839496 D3267322 D1076518 D1768478 D3241851 D2873334 D3100404 D1662316 D2932274 D187838 D2148945 D1430746 D1874971 D3084336 D1789366 D466174 D1437258 D2318717 D3494961 D918281 D3255697 D747163 D2270365 D2236130 D2584855 D1299645 D2652134 D141568 D2177603 D2173944 D1499092 D932852 D1631346 D446014 D3003250 D1150469 D1767097 D637167 D3249370 D2490606 D3211502 D2628577 D2001032 D312326 D3338288 D2560622 D1012552 D1026683 D1035815 D10375 D1042379 D1044737 D1055017 D1059478 D1059759 D1063892 D1071526 D1075400 D1082863 D1089962 D1101341 D1115749 D1132693 D1151608 D115186 D1160427 D1162791 D1164636 D1189077 D1193692 D1193740 D1197424 D1205242 D1205417 D1206349 D1208125 D1210216 D1218102 D1234215 D1234860 D1246165 D126331 D1263976 D127290 D1279804 D1288584 D1289186 D1292165 D1297233 D1305445 D1314590 D1316460 D1316802 D1321710 D1323073 D1325922 D1333940 D1335083 D1346485 D1356551 D1360331 D1360438 D136642 D1366625 D1380232 D1393854 D1396127 D1401524 D140865 D1414743 D1414760 D1418029 D14182 D1419497 D1427093 D1432627 D1434707 D1452472 D1468587 D1488262 D1498952 D1499511 D1507990 D1517611 D152364 D1530709 D1532905 D1542641 D1545491 D1553704 D1556006 D155856 D1600507 D160182 D1604909 D1606310 D1612794 D1628551 D1630314 D1631132 D1631234 D1639455 D1650631 D166426 D1673627 D1674095 D1676653 D1688662 D171004 D1713484 D1720558 D1721148 D172215 D1726713 D1727368 D1730014 D1733249 D1736034 D1740199 D1741629 D1744040 D1744196 D1746370 D1749521 D1754312 D1760695 D1761442 D1764212 D1764927 D1801646 D1814321 D1816771 D1862254 D1864070 D1869462 D1873724 D1888753 D1910136 D1913158 D191532 D1921167 D1921615 D1927959 D1930631 D1944439 D1945995 D195032 D1954836 D1962068 D1971695 D1972836 D1995396 D2001003 D2004016 D2018162 D2022239 D2022641 D2023020 D2049578 D2049960 D2057731 D2060494 D20785 D2088598 D2096343 D21050 D2126254 D2126879 D2131451 D2138298 D214261 D2150151 D2154163 D2155659 D2157965 D2160967 D21790 D2201578 D2218014 D2220244 D2222037 D2232274 D2234960 D2240480 D2249368 D2261704 D2266534 D2270580 D2287001 D2288477 D2295372 D2300656 D2306733 D2310170 D2311090 D2318245 D2322190 D2326680 D2340978 D2350398 D2350834 D235286 D2357146 D2357670 D2358899 D2363120 D2364302 D2364813 D2365371 D2365761 D2379848 D2393684 D240369 D2417385 D2430209 D243896 D2446068 D2455328 D2461516 D2464086 D2468960 D2473851 D2500074 D2511363 D2517443 D2536169 D2541273 D2553381 D2555817 D2560539 D259455 D2616256 D262418 D2625857 D262974 D2638496 D2639692 D2672111 D2674733 D267637 D2680102 D2685999 D268855 D2696324 D2707984 D2713287 D2720611 D2732425 D2742463 D2753142 D2757869 D2760316 D2767475 D2771364 D2778016 D2782373 D278534 D2793082 D2793281 D2803568 D280716 D2810784 D2813899 D2820283 D2834695 D2839163 D2839404 D2847907 D2865338 D2867641 D287696 D2881500 D2882726 D2887788 D289494 D2901020 D2915319 D2922257 D2939514 D2949591 D2953429 D2957600 D2960678 D2964397 D2968650 D2974584 D2977846 D2979317 D297961 D3011564 D3014871 D3023904 D3037071 D3038050 D3043032 D3049239 D3059204 D306057 D306866 D3074768 D3078509 D3081065 D3101532 D3103838 D3122280 D312514 D3132315 D314087 D3148582 D3149959 D3154604 D3159767 D3165716 D316698 D3175527 D3185917 D3205604 D3206703 D320782 D3212601 D3225874 D3237157 D3240867 D3253312 D3259469 D3264526 D3275923 D3276024 D328050 D3289383 D3319195 D3324553 D3355324 D3357800 D3371314 D3373172 D337420 D3386363 D3395585 D3398745 D3400431 D3410996 D341262 D3440774 D3460962 D3464531 D3471857 D3489896 D3495118 D3501701 D3517990 D3522663 D3530512 D3531731 D3544530 D35508 D3560668 D368165 D380065 D383346 D396774 D405091 D414121 D415337 D419557 D423090 D42315 D43785 D448379 D461591 D465392 D46713 D495267 D499716 D504356 D507333 D514779 D522620 D52466 D524940 D525761 D535845 D54429 D544438 D54693 D552433 D55398 D554098 D55503 D555839 D556819 D565444 D577353 D579248 D579464 D580938 D592618 D592995 D594911 D609429 D610137 D618410 D628113 D630805 D637331 D638047 D649109 D650258 D655121 D657341 D664988 D666427 D694281 D699009 D699460 D714459 D724774 D7319 D732003 D751533 D75156 D778517 D783031 D792241 D792515 D801116 D81952 D82339 D832959 D834728 D837408 D840607 D841806 D877470 D884285 D884697 D893701 D908250 D92452 D932812 D944098 D949799 D959016 D969250 D973695 D98313 D998281
1008059,D101326 D2932274 D2760316 D1233108 D1074621 D62037 D2972162 D398561 D1662316 D536378 D1193740 D564273 D1082863 D3240867 D2535542 D1132693 D1075400 D1726516 D3206703 D3154604 D1038184 D443449 D3080098 D615848 D3278815 D195032 D2584855 D2310170 D524940 D1266379 D388734 D307510 D1396004 D330431 D2736207 D3462168 D2999835 D564353 D3070021 D2146217 D978795 D274958 D3196658 D1173570 D2210547 D3080617 D2132296 D461591 D3395585 D3398158 D1206531 D1316802 D1541874 D1403319 D2005532 D2072010 D837408 D2592704 D3071514 D1568694 D3207660 D2077590 D3372713 D1744196 D2466022 D3400431 D522620 D1631346 D2963151 D638152 D1978320 D344995 D1746370 D3075569 D592618 D3207256 D3000214 D3367409 D2639533 D1372829 D259137 D1108736 D1024962 D1315654 D127290 D442910 D1187780 D1997715 D2182309 D3043032 D1292165 D2922257 D368165 D312514 D235277 D2234960 D555839 D1160798 D1064185 D297961 D1532905 D2307568 D2461516 D2596035 D2732425 D1263976 D931621 D664988 D1737423 D2261704 D3530512 D863825 D1709809 D1923639 D3089863 D728021 D246195 D1360438 D337107 D512867 D1929546 D3078509 D122071 D3059204 D1316991 D1760695 D3402967 D1558720 D465392 D2193856 D2032782 D1871074 D3487498 D2519457 D2771694 D751533 D1632187 D3433712 D488101 D2720611 D167424 D2744374 D1434707 D2295659 D1846446 D792515 D2005111 D2248376 D2680102 D2463887 D2026282 D3232522 D1297233 D2158881 D331856 D1845615 D998007 D3074768 D1150469 D1044737 D2437890 D3267322 D2535397 D2218579 D2018162 D1853439 D152364 D998281 D2270580 D423380 D1335083 D2364813 D638647 D609429 D92178 D3132315 D187838 D2980881 D55503 D1455843 D655121 D3149959 D2222627 D2757869 D3494961 D2927443 D2220569 D2005985 D3371314 D3498734 D2574661 D1419276 D2022867 D1448263 D189763 D1297929 D650258 D15513 D1127292 D109882 D1911840 D2661828 D2395825 D941559 D841806 D20260 D1830481 D41618 D327182 D221988 D3484406 D3192013 D3212601 D2249918 D853788 D810432 D736293 D3248755 D3501701 D1768478 D3100404 D2273207 D1585045 D3201044 D2886245 D3084336 D1437258 D432433 D442764 D312326 D612714 D2554503 D673884 D1122700 D2177603 D262418 D3373172 D1953995 D2158112 D2096043 D298380 D1121253 D446014 D1330247 D3241919 D355883 D2974570 D3175584 D567694 D316698 D2832293 D3249370 D2490606 D930628 D378339 D2459044 D435050 D3195869 D1430746 D2643524 D932852 D395739 D876483 D2767475 D1865077 D2270365 D1051544 D146610 D540613 D1809502 D1002679 D1003444 D100637 D1008862 D1012552 D1026683 D1028894 D1035815 D1036248 D1036608 D10375 D1042221 D1042379 D1051131 D1051337 D1055017 D1055971 D1059478 D1059759 D1059834 D1060014 D1063892 D1067149 D1068252 D1069666 D1071526 D1073818 D1076518 D1077883 D1088545 D1089962 D1101341 D1105767 D1115749 D1123717 D114228 D1146395 D1151608 D115186 D1160427 D1162791 D1164636 D1171818 D1187311 D1189077 D1190448 D1193447 D1193692 D1197424 D1205242 D1205417 D1206349 D1208125 D1210216 D1213261 D1218102 D1223636 D1234215 D1234860 D1246165 D1249489 D1261305 D126331 D126942 D1279804 D1288584 D1289186 D1294227 D1299645 D1299667 D1304667 D1305445 D1306523 D1307769 D1314590 D1314619 D1316460 D1320973 D1321710 D1323073 D1325922 D1333940 D1346485 D1356551 D1360331 D1362171 D1365469 D136642 D1366625 D1380232 D1393003 D1393854 D1396127 D1401524 D140865 D1414743 D1414760 D141568 D1418029 D14182 D1419497 D1427093 D1432627 D1448239 D144895 D1452472 D1458736 D1468587 D1471300 D1474883 D1481311 D1488262 D1488756 D1496378 D1498952 D1499092 D1499511 D1504331 D1507990 D1509737 D1517611 D1519469 D1530709 D1540728 D154108 D1542641 D1542797 D1543620 D1545491 D1551421 D1553704 D1556006 D155856 D1559964 D1568493 D1576479 D1600507 D160182 D1604909 D1606310 D1612794 D1613714 D1628551 D1630314 D1631132 D1631234 D1639455 D1648320 D1650631 D1655862 D1658734 D166417 D166426 D166713 D167346 D1673627 D1674095 D1675096 D1675704 D1676653 D1678969 D1687540 D1688662 D16993 D170210 D1704511 D1707568 D171004 D1713484 D1714344 D1717049 D1720162 D1720558 D1721148 D172215 D1726713 D1727368 D1730014 D1730533 D1733249 D1736034 D1738121 D1739082 D1740199 D1741629 D1744040 D1749521 D175093 D1753642 D1754312 D1761442 D1764212 D1764927 D1767097 D1771658 D178291 D1783399 D1784760 D1789366 D1801646 D1814321 D1815195 D1816771 D1819623 D1827643 D1848859 D1855037 D185539 D1862254 D1863915 D1864070 D1869462 D1873724 D1874971 D1887367 D1888753 D1894600 D1897831 D1902863 D1910136 D1913158 D191532 D1918464 D1921167 D1921615 D1927959 D1930631 D1935484 D1944439 D1945995 D1954836 D1962068 D1969603 D1971695 D1972836 D1974071 D1976910 D1983821 D1995396 D1999410 D2001003 D2001032 D2004016 D2011868 D2022239 D2022641 D2023020 D2027571 D2027702 D2046736 D2049578 D2049960 D2057731 D2060494 D2074538 D20785 D2080227 D2080459 D2081262 D2088598 D2096343 D21050 D2115900 D2117298 D2117450 D2125231 D2126254 D2126879 D2131451 D2132473 D2133352 D2136646 D2138298 D2140971 D2141166 D214261 D21472 D2148945 D2150151 D2154163 D2155659 D2157965 D2160967 D2161829 D2173944 D21790 D2188167 D2197073 D2200646 D2201578 D2209307 D2218014 D2220126 D2220244 D2222037 D2225125 D2232274 D2234835 D2236130 D2240480 D2249368 D2253156 D2257759 D2260663 D2266534 D2279124 D2279273 D2287001 D2288477 D2295372 D2300656 D2304369 D2306733 D2309200 D2311090 D2318245 D2318717 D2321938 D2322190 D2326680 D2330828 D2333603 D2338562 D2340978 D2341214 D2348094 D2350398 D2350834 D235122 D235286 D2355512 D2357146 D2357670 D2358899 D2363120 D2364302 D2365371 D2365761 D2367362 D2377761 D2379848 D2383925 D2384728 D2393684 D2399013 D2403620 D240369 D240559 D2406185 D2417385 D2425986 D2430209 D2435453 D243896 D2442019 D2442881 D2442966 D2445545 D2446068 D2455328 D2464086 D2468556 D2468960 D2472236 D2473851 D2500074 D2509316 D2511363 D2517443 D2520434 D2523601 D2525761 D2534774 D2536169 D2541273 D2545379 D2552048 D2553381 D2555817 D2560539 D2560622 D2590534 D2591611 D259455 D260523 D2611209 D2616256 D2618605 D2625857 D2627250 D2628577 D262974 D2638496 D2639692 D2645115 D2652134 D265708 D2666861 D2672111 D2674733 D267637 D2679376 D2685999 D268855 D2692505 D2696324 D2704261 D2707984 D2713287 D2727198 D2741516 D2742463 D2753142 D2754300 D2755770 D2771364 D2778016 D2782373 D2782903 D278534 D2793082 D2793281 D279470 D279834 D2803568 D2804859 D2806215 D280716 D2810784 D2813899 D2820283 D2834695 D2834771 D2839163 D2839404 D2847907 D2865338 D2866481 D2867641 D2872230 D2873334 D287696 D2878732 D2881500 D2882726 D2887788 D2888496 D2889778 D2893560 D289494 D2899361 D2901020 D2907167 D2915319 D2927654 D2938018 D2939514 D2949591 D2952133 D2953429 D2955179 D2957600 D2957844 D2960678 D2962724 D2964397 D2968650 D2974584 D2977846 D2979000 D2979317 D2984334 D2999346 D3000709 D3003250 D3009489 D3011564 D3011611 D3014871 D3023904 D3037071 D3038050 D3047567 D3049239 D306057 D3065831 D306866 D3077925 D3081065 D3101532 D3103838 D3113293 D3122280 D312898 D3139538 D314087 D3148582 D3152550 D3159767 D3161039 D3165037 D3165716 D3174399 D3175527 D318396 D3185917 D3196205 D3205604 D320782 D3211502 D3212918 D3223519 D3225297 D3225874 D322770 D3233895 D3237157 D3241851 D3243389 D3253312 D3255697 D3259469 D3264526 D3275923 D3276024 D3276027 D3278147 D3280491 D328050 D3289383 D3294385 D3296808 D3298755 D3309452 D3314189 D3318986 D3319195 D3324042 D3324553 D3330476 D3338288 D3341152 D3355324 D3357268 D3357800 D3366377 D3369576 D337420 D3377971 D3386363 D3398745 D3410996 D341262 D3438995 D3440424 D3440774 D3442592 D3454252 D3458398 D3460962 D3464531 D3471857 D3486930 D34872 D3488707 D3489896 D3492633 D3495118 D3506569 D3517990 D3522663 D3523627 D3527133 D3531731 D3539476 D3544530 D35508 D3552544 D3560668 D365582 D368473 D372313 D374626 D379831 D380065 D382696 D383346 D386037 D38841 D396774 D405091 D406956 D408812 D414121 D415337 D418008 D418375 D419557 D423090 D42315 D4240 D424114 D426361 D435837 D43785 D442273 D448379 D448506 D457387 D466174 D46713 D491379 D495267 D497664 D499716 D504356 D507333 D512532 D513912 D514779 D521195 D52466 D525761 D531684 D532863 D535845 D54429 D544438 D54693 D552433 D55398 D554098 D556819 D561195 D563763 D565444 D568786 D572777 D575080 D577353 D579248 D579464 D580938 D585851 D592995 D594911 D610137 D617364 D618410 D620028 D627593 D628113 D629674 D629711 D630805 D637167 D637331 D638047 D649109 D657341 D664085 D666427 D686370 D694281 D699009 D699460 D700178 D705864 D714459 D715484 D724774 D7319 D732003 D732177 D733245 D740154 D744477 D747163 D748675 D75156 D756483 D768804 D771079 D778517 D783031 D792241 D801116 D811206 D812586 D81952 D82339 D832959 D83314 D834728 D837442 D839496 D840607 D84701 D853987 D860134 D866220 D877470 D884285 D884697 D893701 D903278 D9077 D908250 D913761 D918281 D92452 D932812 D934311 D944098 D949799 D954322 D955417 D959016 D963522 D966571 D969250 D973695 D976606 D982730 D98313 D983667 D992927 D996204 D996804 D996969
